offset,modbus_address,name,value,count,type,size,scale_factor,units,rw_access,mandatory,static,label,description
,40002,1 | uint16,,,uint16,,,,Common | Model ID,Model identifier,,,
,40003,uint16,,,uint16,,,,S | Model Len | Model ID,Model len h | Model identifier,,,
,40014,WChaRteMax,,,uint16,,,,Nameplate Ener Capacity,,,Nameplate energy capacity in DC watt-hours,s
,40020,Mn | Md | string,16,,string,,,,S | Model | Manufacturer,Manufacturer specific value (32 chars) | Well known valuer istered with Sun,,,For compliance
,40036,Opt | string,8,,string,,,,S | Options,Manufacturer specific value 16 chars | Manufacturer specific value (32 chars),,,s
,40052,Vr | SN | strin,,,string,,,,S | Serial Number | Version,Manufacturer specific value (32 chars) | Manufacturer specific value (16 chars),,,s
,40068,uint16,,,uint16,,,,S | Device Address,Modbus device address | Manufacturer specific value (32 chars),,,s
,40071,ID,,,uint16,,,,S | Model ID,,,Model ID,Model identifier
,40072,L,,,uint16,,,,S | Model Length,,,Model Length,Model length
,40075,WDiscnaRteMax,,,uint16,,,,Na,late Max Charge Rate Maximum rate of energy transfer into the stor e device in DC watts.,,,
,40076,SoCMax | DisChaRte,,,uint16,,WHR,,Self Discnarge Rate | Nameplate Max Discharge Rate Maximum out of the st,,,Self discharge rate,E device in DC watts
,40078,SoCMax | SOCMin,,,uint16,,WHRte | WHR,,Nameplate Max SoC,,,"Manufacturer maximum state of Charge, expressed as a percentage",s
,40079,SocRsvMax,,,uint16,,WHR | WiiR,,Nameplate Min SoC,,,Manufacturer minimum statgg_gaew.gxvessed as a percenta e,s
,40080,SOCRsvMin,,,SOC SF,,WiiR | WHR,rw,Max Reserve Percent | Min Reserve for minimum reserve for storage as a percentage of the nominal maximum storage.,,,Setpoint for maximum reser ae for storage as a percentage of the nominal maximum storage,
,40082,DoD,,,uint16,,,,State of Char e | Depth of Discharge,,,"State of charge, expressed as d percentage | Depth of discharge. expressed as a percentage-",
,40083,,,,uint16,,,,State of Health | Depth of Discharge,,,Depth of discharge. expressed as a percentage- | Percenta e of battery Ilfe remaining,
,40084,,,,uint16,,,,State of Health | Cycle Count,,,Number of Ies executed i n the battery | Percenta e of battery Ilfe remaining,
,40086,Chast | OFF | EMPTY | CHARGING | DISCHARGING,,,enum16,,,,Cycle Count | Charge Status,,,Charge status of storage dev ce Enumeration | Number of Ies executed i n the battery,s
,40087,CHARGING | TESTING | FULL | HOLDING | LocRemCtl | REMOTE,,,enum16,,,,RO,,,Battery control mode. Enumeration,s
,40088,LOCAL,,,uint16,,,,Battery Heartbeat,,,Value is incremented every second wrth penodic resets to zero,s
,40089,CtrlHb,,,uint16,,,,RO,,,Vd lue is resets to zero,s
,40091,Typ | NOT APPLICABLE UNKNOWN | LEAD ACID | NICKEL METAL HYDRATE | NICKEL CADMIUM | LITHIUM ION | CARBON ZINC,,,enum16,,,,datterv T,,,Twe of battery. Enumeration,
,40092,RECHARGEABLE ALKALINE | OTHER | ZINC CHLORIDE | ALKALINE | SOOILIM SULFUR | FLOW | State,,,enum16,,,,State of the Battery pank,,,"State of the battery bank, Enumerat on",s
,40093,SteteVnd | DISCONNECTED | CONNECTED | FAULTED,,,enum16,,,,Vendor Battery Bank State,Operational State | Vendor specific batt,,Bank state. Enumeration,S
,40096,WerrDt | POWER SAVING | MAINTENANCE | Evtl | OVER SOC MAX WARNING | VOLTAGE IMBALANCE WARNING | ALARM | IEMPERATURE IMBALANCE WARNING | CONTACTOR ERROR | FAN ERROR | GROUND FAULT | OPEN DOOR ERROR | OTHER ALARM | OTHER WARNING | RESERVED 1 | CONFIGURATION ALARM | CONFIGURATION WARNING | RESERVED,,,bitfield32,,,,Warranty Date | Bett Event Bitfield,Alarms and warnings. Bit fla | Date the device warranty expires.,,,s
,40100,EvtVnd1 | EvtVndi | RESERVED,,,bitfield32,,,,Vendor Event Bitfield I,Veneot def•neo events.,,,-4
34,40104,v,,,uint16,,,,,,,,
35,40105,V Max,,,uint16,,v,,External Battery Voltage,WHRtg,,,
36,40106,VMin,,,uint16,,v,,Battery Voltage,Instantaneous maximum battery voltage.,,,
37,40107,CellV,,,uint16,,,,Min Battery Voltage,M,,Cell Voltage,Cell terminal voltage
38,40108,CellV,,,uint16,,,,Max Cen Voltage,Maximum Wltace for all cells in the bank.,,Cell Voltage,Cell terminal voltage
39,40109,CellV,,,uint16,,,,Max Cell Voltage Str.nz,Str.ng conte•ning the cell With maximum e.,,Cell Voltage,Cell terminal voltage
40,40110,cell'VMin,,,uint16,,,,Max Cell Voltage Moaule | Min Cell Vogyg_e,Moeule conta•ning the cell With maximum voltage-,,,
41,40111,CellV,,,uint16,,,,'Min Cell Voltage Strin | Min Cell Vogyg_e,Mintmum Oltege for BII cells In the bane,,Cell Voltage,Cell terminal voltage
42,40112,CellV,,,uint16,,,,'Min Cell Voltage Strin | Min Cell Voltue Module,,,Cell Voltage,Cell terminal voltage
.13,40113,CellV,,,uint16,,,,Average Cen Voltage | Min Cell Voltue Module,Module conta.ning the cell with mtmmum voltage.,,Cell Voltage,Cell terminal voltage
45,40115,ACttaMax,,,int16,,,,Total DC Current | Mex Charge Current,Total DC current the battery,,,
46,40116,ADisChaMax,,,uint16,,,,Mex Charge Current | Max Discharge Current,Instantaneous maxtmum DC cnarge current,,,s
48,40118,START | ReqlnvState | NO REQUEST,,,enum16,,,,Total Power | Inverter State Request,Total power flowing to/from the battery bane | Request from battery to inverter. Enumeration.,,,s
,40119,STOP | START | ReqW,,,w | SF,,w,,Battery Power Request,,,,
,40120,SetOp | CONNECT,,,enum16,,,rw,Set Operation,AC Power requested bv battery | Instruct the betterv bank to,,,Tior such as connecting. Enumerp9gae
51,40121,SeunvStetc | DISCONNECT | INVERTER_STOPPED | INVERTER _STAN08Y,,,enum16,,,,Set Inverter State,"Set tne current state of tne inverter,",,,
53,40123,WHRtg SF | INVERTER STARTED,,,sunssf,,,,,'Scale factor foc capacity. | Scale factor tor energy capacity,,,
54,40124,WChaDisChaMax SF,,,sunssf,,,,,"'Scale factor foc max•mum charw and disch&tge rate, | Scale factor tor energy capacity",,,
55,40125,DisChaRte SF,,,sunssf,,,,,"'Scale factor foc max•mum charw and disch&tge rate, | Scale factor for self rete.",,,
,40126,SOC SF,,,sunssf,,,,,"Scale factor for self rete. | Scale factor for stbte of Charge values,",,,
57,40127,DoD,,,,,,,,"Scale factor for depth ot duscnar*e | Scale factor for stbte of Charge values,",,,
,40128,SOH,,,sunssf,,,,,Scale factor for state of health.,,,
,40129,CellV,,,sunssf,,,,,"Scale factot for DC bus volta e,",,Cell Voltage,Cell terminal voltage
,40131,CellV,,,sunssf,,,,,"Scale factor for cell VOItd e, | Scale factor for DC current.",,Cell Voltage,Cell terminal voltage
,40132,AMax SF,,,sunssf,,,,,Scale factor for instantaneous DC charee/discharge current,,,
401M,40134,ID,,,,,,,,S,,Model ID,Model identifier
40135,40135,L,,,,,,,,S,,Model Length,Model length
40137,40137,NMod,,,,,,,,Module Count,,,-Count of modules in the string
40138,40138,St | STRING_ENABLED,,,string,,,,,Str tus,,,Current status of the str ng
40140,40140,UConFaii | CONTACTOR STATUS | DBUTTON PUSHED | NO_FAILURE | STR_GROUND FAULT | OUTSIDE VOLTAGE RANGE,,,1 | 2 | 3,,,,,Connection Failure Reason,,,s
40141,40141,STRING NOT ENABLED | FUSE OPEN | CONTACTOR FAILURE | PRECHARGE FAILURE | STRING FAULT | NCellBal,,,string,,,,,Strin,,: Number of cells currentjv be'ng balanced in the string,
• 40142,40142,,,,,,soc,sf,,String State of,,: Number of cells currentjv be'ng balanced in the string | Battery stnng state of charge. expressed as a percentage,
,40143,Doo,,,,,DoD SF,,,St!ing Dgpyn ot Dischargg | String Cycle Count,,'Depth of smog. expressed as percentage | Number of discharge cycles executed upon the string | Battery stnng state of charge. expressed as a percentage,s
,40149,CellV,,,uint16,,CellV SF,v,,Max Cell Vp'ygge,,Cell Voltage,Cell terminal voltage
40150,40150,CellV,,,uint16,,,,,Max Cey Voltaee Module,,Cell Voltage,Cell terminal voltage
40152,40152,CellV,,,uint16,,CellV,,,Cell Voltage | Min Cell_yoltage Module _lModule conta•ning the cell Witn mimmum cell voltage.,,Cell Voltage,Cell terminal voltage
,40155,ModTmpMaxM0d,,,,,,,,Max Mocute Temper•ture Module •Module wth the maxjmum temperature.,,'daxmum temperature for ali modules in the string,s
40156,40156,MOdTmpMin | ModTmpMinMod,,,,,,c,,Module Temperature,,Mimmum temperature for all modules n the string,s
40158,40158,ModTmpMinMod | M Odl m | Pddl,,,,,ModTmp SF,c,,M,,Average temperature for all modules in the | Pad register,
26 | 40160,40160,ConSt | CONTACTOR,,,,,,,,S,,Status of the contactor(s) for the string | Pad register,s
40161,40161,CONTACTOR O | CONTACTOR | CONTACTOR 2 | CONTACTOR 3 | CONTACTOR 4 | CONTACTOR 6 | CONTACTOR 8 | 1 | RESERVED 24 | RESERVED 25 | RESERVED 26 | RESERVED 27 | RESERVED 28 | RESERVED 29 | RESERVED 30 | CELL OVER VOLTAGE 13 | RESERVED 31,,,11 | 10 | 12 | 13 | 14,,,,,,,,
432,40162,CellV,,,int16,,,,,,,Cell Voltage,Cell terminal voltage
40164,40164,Evt2,,,,,,,,String Event 2,,Alarms. warnings and status values. Bit flags,
40166,40166,EvtVnd1 | RESERVED 16 | RESERVED 23 | RESERVED 17 | RESERVED 18 | RESERVED 19 | RESERVED 20 | RESERVED 21 | RESERVED 22 | RESERVED 24,,,,,,,,Vendor Event Bitfield I,,Vendor defined e aents,
40161,40167,CELL OVER VOLTAGE 13 | CELL UNDER VOLTAGE 13 | RESERVED 2 | CEU OVER TEMPERATURE 13 | RESERVED a | RESERVED S | CHARGE_OVER CURRENT 13 | DISCHARGE OVER CURRENT,,,,,,,,,,,
40168,40168,iRESERVED 10 | RESERVED | PACX.BMS INTERNAL FAULT 13 | RESERVEO | RESERVED 12 | RESERVED 13 | RESERVED 14 | Evtvnd2 | SYSTEM_CRITICAE Q,,,int16,,,,,Vendor Event Bitfield 2,,Vendor eefinea events,
40169,40169,IF_STOP INPUT ACTIVE 12 | OC LINK OVERVOLTAGE Q | DC UNK UNDER VOLTAGE | PACK BMS SUPPLY UNDERVOLTAGE Q | PACX SUPPLY OVERVOLTAGE U | OCPM OVERTEMPERATURE 12 | DCPM UNDERTEMPERATURE 12 | PRECHARGE FAULT 12 | 12,,,2 | 4 | 6 | 8 | 1 | 3 | 5 | 7,,,,,,,,s
40170,40170,SetEna | PRECHARGE FAULT 12 | POS MAIN CONTACTOR FAULT 12 | NEG MAIN CONTACTOR FAULT Q | PACK BMS saus COMM FAULT u | PACK_BMS CSB COMM FAULT 12 | INCON ACCUMULATED CELL VOLTAGE VS | NEG FUSE FAULT 12,,,acc32,,,,RW,,,Commumcetlon to SEMS IS not worki reliably | Inconsistency between accumulated Cell voltages and DC link voltage detected | Enables and disables the string. Should reset to O upon compleVon,s | S
,40171,SetCon | CONNECT STRING | DISCONNECT_STRING,,,string,,,,RW,Cornect/D•sconnect String,,Connects and disconnects the string,s
40173,40173,DISCONNECT_STRING | SOC SF | SoH SF,,,string,,,,,,,Scale factor for str ng state of Charge | -Scale factot for string state of health,
,40174,000 SF,,,,,,,,,,Scale factot for stnng depth of discharge,
,40175,,,,,,,,,,,Scale factor tor stnng current,
40176,40176,,,,,,,,,,,Scale factor for stnng voltage,
,40177,CellV,,,uint16,,,,,,,Cell Voltage,Cell terminal voltage
40178,40178,ModTmp_SF | Pad2,,,,,,,,_ Pad,,Scale tactor for mocule temperature,
470,40180,CellSt,,,bitfield32,,,,,-Cell Status,,Cell Status,Status of the cell
40181,40181,,,,,,,,,Pad,,Pad revster,
40182,40182,o | MocNCen | Stnng_module,,,o,,,,,Module Ceil Count,,Count of all cens 'n the module,
40183,40183,1 | MOdSoC,,,,,SOC SF,,,", Module SoC",,Module state of charge. expressed as a percentage,
"40184 ,",40184,2 | MOCSoH,,,,,,,,Module SoH,,Module state of health. expressed as percentage,
40185,40185,CellV,,,uint16,,Ceuv,,,IMax Cell Voltage,,Cell Voltage,Cell terminal voltage
40186,40186,CellV,,,uint16,,,,,Cell VOIts:e Cev,,Cell Voltage,Cell terminal voltage
40187,40187,CellV,,,uint16,,Ceuv SF,,,M,,Cell Voltage,Cell terminal voltage
,40188,6 | MOdCeIlVM.nCel,,,,,,,,,,,
40189,40189,CellV,,,uint16,,CellV,sf,,Average Cen Voltage,,Cell Voltage,Cell terminal voltage
56 | 40190,40190,CellTmp,,,int16,,MgdTrpp,,,Max Cell Temperature,,Cell Temperature,Cell temperature
57 | 40191 | 63,40191,CellTmp,,,int16,,,,,Max Cell Temperature Cell | Pad,,Cell Temperature,Cell temperature
58 | 40192,40192,10 | ModCellTm Min,,,,,ModTm,,c,Min Cell Temperature,,,Minimum temperature for all cells in the module
59 | 40193,40193,MOdCelITmpMlnCell,,,,,,,,Min Cell Temperature Cell,,,Cell with minimum temperature | Average temperature for all cells in the module
60 | 40194,40194,12 | ModCel ITmpA,,,,,M0dTm,,c,Avera e Cell Temperature,,,Average temperature for all cells in the module
61 | 40195,40195,13 | Pdd5,,,,,,,,Pad,,,Pad register
62 | 40196,40196,14 | Pad6,,,,,,,,Pad,,,Pad register
63 | 40191,40197,15 | Pad,,,,,,,,,,,
64 | 40198,40198,o | ModNCell,,,,1,,,,Module Cell Count,,,Count of all cells in the module
40199,40199,1,,,,,,soc sf,,Module SoC,,,"Module state of chaw, expressed as a percentage"
66 | 40200,40200,2 | ModSoH,,,,,,soh st,,Module Soi',,,Module state of health expressed as a percentage
67 | 40201 | 73 | 40207,40201,CellV,,,uint16,,,cellv sf,,Max Cell Voltage | ax Cell Temperature Cell,,Cell Voltage,Cell terminal voltage
68 | 40202,40202,CellV,,,uint16,,,,,Max Cell Voltage Cell,,Cell Voltage,Cell terminal voltage
69 | 40203,40203,CellV,,,uint16,,,cellv sf,,Min Cell Volta e,,Cell Voltage,Cell terminal voltage
40204,40204,ModCeIIVMinCell,,,,,,,,Min Cell Voltage Cell,,,Cell with rmmmum voltage
71 | 40205,40205,CellV,,,uint16,,,cellvsf v,,Average Cell Voltage,,Cell Voltage,Cell terminal voltage
72 | 40206,40206,8 | ModCellTm ax | Il'tmnwmmummmnnnnnutunmm,,,,,M0dTmpSF C,,,Max Cell Temperature,,,' Maximum temperature for all cells in the module
73,40207,9 | ModCei IT mpMaxCel I,,,,,,,,ax Cell Temperature Cell,,,Cell with maximum temperature
74 | 40208,40208,CellTmp,,,int16,,,mod tm sf,c,in Cell Temperature,,Cell Temperature,Cell temperature
,40209,CellTmp,,,int16,,,,,Min Cell Temperature Cell,,Cell Temperature,Cell temperature
76 | 40210,40210,CellTmp,,,int16,,,modtm sf,c,Average Cell Temperature,,Cell Temperature,Cell temperature
40211,40211,13 | Padb,,,,,,,,Pao,,,Pad register
78 | 40212,40212,14 | PBd6,,,,,,,,Pad,,,Pad register
79 | 40213,40213,Pad,,,,,,,,Pad,,,Pad register
80 | 40214,40214,o | ModNCeII,,,,2,,,,Module Cell Count,,,Count of all cells in the module
81 | 40215 | 40275,40215,ModSoC | PadS,,,,,,soc,,Module SoC,,Pad register,"Module state of cnerge, expressed as a percentage"
82 | 83 40217 | 40216,40216,CellV,,,uint16,,,cellv sf | soh,,'Module SoH | 'Max Cell Voltage,,Cell Voltage,Cell terminal voltage
83 40217 | _ 40218,40218,CellV,,,uint16,,,cellv sf,,'Max Cell Voltage | Max Cell Voltage Cell,,Cell Voltage,Cell terminal voltage
40219,40219,JModCeli_vytn,,,,,,cellv sf,,Min Cell Voltage,,,'M.mmum voltage for all cells in the module
40220,40220,6 | ModCelIVMinCell | 7 | MOdCel IVAvg,,,,,,cellv st,v,Min Cell Voltage Cell,,,Cell with minimum voltage
89 | 40223,40223,CellTmp,,,int16,,,,,Max Cell Cell maximum temperature.,,Cell Temperature,Cell temperature
90 | 40224,40224,10 | ModCeilTmpMtn,,,,,,modtmp,,Min Cell Temperature,,,Minimum temperature for all cells in the module
91 | 40225,40225,MOdCellTm9MInCell,,,,,,,,Min Cell Temperature Cell,,,Cell with rmmmum temperature
92 | 40226,40226,CellTmp,,,int16,,,modtmp_ | sf,,Average Cell Temperature,,Cell Temperature,Cell temperature
,40229,15 | Padl,,,,,,,,Ped,,,Pod register | Paa reg
98 | 40230,40230,1 | MOOSOC,,,,3,,soc sf,,I Module SoC | Module Cell Count,,,Pod register | 'Count of all cells in the module | Module state of charge. expressed as a percentage
100 | 99,40233,CellV,,,uint16,,,cellv | soh | sf,v,Max Cell Voltage | Module SoH,,Cell Voltage,Cell terminal voltage
100 | 102,40235,CellV,,,uint16,,,cellv | sf,,-Max Cell Voltage Cell,,Cell Voltage,Cell terminal voltage
102 | 103 | 402% | aoul f,40237,CellV,,,uint16,,,cellv,,"- Mtn Ceil voltage Cell | ""Average Cell VOIt•ge",,Cell Voltage,Cell terminal voltage
,40238,CellTmp,,,int16,,Mod Imp,,,,,Cell Temperature,Cell temperature
40239,40239,CellTmp,,,int16,,Mod Imp,sf c,,Max Cell Temperature,,Cell Temperature,Cell temperature
40240,40240,CellTmp,,,int16,,,,,Max Cell Temperature Cell,,Cell Temperature,Cell temperature
40241 | 40247,40241,CellTmp,,,int16,,SOC,,,Min Cell Temperature,,Cell Temperature,Cell temperature
40242,40242,12,,,,1,ModTmp,,,Min Cell Temperature Cell,,Cell With mm mum temperature,
40243,40243,13 | Pad5,,,,1,ModTmp,,,Average Cell Temperature,,Aeggg_rmperature for all cells in the module,
40244,40244,14 | Pad6,,,,,,,,Pad,,Pad 'Stet,
40245,40245,15 | Pad,,,,,,,,Pad,,Pad regtster,
40246,40246,o | ModNCell,,,4,,,,,Pad,,Pad r 'ster,
,40247,1,,,,,,,,Module Cell Count,,Count of cells in the module,
40248,40248,2 | MOdSoH,,,,,SOC | SoH,,,Module SoC,,Module state of charge. expressed as percentage,
40249,40249,3 | MOdCe11VMax,,,,,SoH | CellV sr,,,Module SoH,,I Module state of health expressed as a,
40250,40250,4 | Mooce11VMaxCell,,,,,CellV sr,,,Max Cell Volta e | Max Cell Voltaee Cell,,Maximum voltage for all cells in the module,
40251,40251,CellV,,,uint16,,CellV,,,Max Cell Voltaee Cell | Min Cell Voltage,,Cell Voltage,Cell terminal voltage
40252,40252,CellV,,,uint16,,,,,Min Cell Voltage Cen,,Cell Voltage,Cell terminal voltage
40253,40253,7,,,,,CellV SF,,,Min Cell Voltage Cen | Average Cell Voltage,,Cell mth mimmum Eltage,
40254,40254,CellTmp,,,int16,,ModTmp_SF,,,Average Cell Voltage | Max Cell Temperature,,Cell Temperature,Cell temperature
40255,40255,CellTmp,,,int16,,,,,Max Cell Temperature | Cell Temperature Cell,,Cell Temperature,Cell temperature
40256,40256,CellTmp,,,int16,,Mod Imp,c,,Cell Temperature Cell | Tin Cell Temperature,,Cell Temperature,Cell temperature
• 40251,40257,CellTmp,,,int16,,,,,Min Cell Temperature Cell,,Cell Temperature,Cell temperature
40258,40258,CellTmp,,,int16,,ModTmp,c,,Min Cell Temperature Cell | Average Cell Temperature,,Cell Temperature,Cell temperature
40259,40259,13 | Pads,,,,,,,,Average Cell Temperature | Pac,,'Average temperature for all cells the module | pad register,
40260,40260,14 | Ped5,,,,,,,,Pac | Pad,,Pad register,
40261,40261,15 | Pad,,,,,,,,} Pad,,'Pad register,
40262,40262,o | ModNCell,,,5,,,,,Module Cell Count,,Count of all cells in the module,
40263,40263,ModSoC,,,,,SOC,,,Module SoC,,Count of all cells in the module | iModule state of charge. expressed as a percentage,
40264,40264,2 | MOdSOH,,,,,SoH SF,,,Module SoH,,"Module state of health, percentage",
40265,40265,CellV,,,uint16,,CellV,,,Max Cell Voltage,,Cell Voltage,Cell terminal voltage
40266,40266,4 | ModCel IVMaxCell,,,,,,,,Cell Voltate Cell,,DMaxomum voltage foc cells n the module | Cell With maximum volt ge,
40267,40267,CellV,,,uint16,,CellV SF,,,M,,Cell Voltage,Cell terminal voltage
40268,40268,MOdCeIlVMinCell,,,,,,,,M,,M.mmum voltage tor cells in the module | Cell mth rmrumurn voltage,
,40269,CellV,,,uint16,,CellV SF,,,IAvetage Cell Vonage,,Cell Voltage,Cell terminal voltage
,40270,CellTmp,,,int16,,ModTmp,c,,Max Cell Temperature,,Cell Temperature,Cell temperature
,40271,9 | ModCel IT mpMaxCell,,,,,,,,Max Cell Temperature Cell,,Cell with mammum temperature,
402n :,40272,10 | i ModCeI (TmpMin,,,,,ModTmp,c,,Min Cell Temperature,,I Minimum temperature for cells in the module | Cell with mammum temperature,
40274,40274,CellTmp,,,int16,,Modi m p,,,M,,Cell Temperature,Cell temperature
,40275,PadS,,,,,,,,,,Average temperature for n the module,
40216,40276,14 | Pad6,,,,,,,,Pad,,IPad register,
40277,40277,Pad,,,,,,,,Pad,,Pad register,
,40278,o | MOdNCell,,,6,,,,,Module Cell Count,,Count of all cells n the module,
402n,40279,1 | ModSoC,,,,,SOC,,,Module SoC,,Mocule state of charge. expressed as a percentage,
40280,40280,2 | M0dSoH,,,,,SOH„SF,,,tModuIe SOH,,Module state of health. expressed as percentage,
147 | 40281,40281,CellV,,,uint16,,CellV Sf,,,'Max Cell Voltage,,Cell Voltage,Cell terminal voltage
40282,40282,4 | M0dCeIIVMaxCell,,,,,,,,MBA Cell voltage Cen,,Cell manmum voltage,
40281,40283,5,,,,,,,,M,,M.mmum voltage for all celts In the module,
40284,40284,CellV,,,uint16,,,,,", Min Cen Voltage Cell",,Cell Voltage,Cell terminal voltage
40285,40285,CellV,,,uint16,,CellVSf i,sft¯,,Average Cen Voltage,,Cell Voltage,Cell terminal voltage
40286,40286,CellTmp,,,int16,,ModTm,c,,Max Cell Tgnægture,,Cell Temperature,Cell temperature
4028/,40287,9 | ModCell I,,,,,,,,Max Cell Temperature Cell,,Cell with maximum temperature,
40188 | 40288,40288,CellTmp,,,int16,,Modi m,c,,'-din Cell VOIt3'e Ceil | Cell Temperature,,Cell Temperature,Cell temperature
40289,40289,ModCel IT m inCell,,,,,,,,. Min Cell Temperature Cell,,Cell with minimum temperature,
40290,40290,12 | ModCel I T,,,,,ModTmp,c,,Average Cell Temperature,,,Cells in the module
40291,40291,13 | PadS,,,,,,,,Pad,,Register,
40292,40292,14 | Pad6,,,,,,,,,,Pad reg ster,
40293,40293,Pad7,,,,,,,,Pad,,Pad register,
,40294,o | ModNCell,,,7,,,,,M,,"Count of dll cells in the m,0dule",
161,40295,1 | ModSoC,,,,,SOC Sf,,,Module SoC,,Module state of charge. expressed as a percentage,
,40296,2 | ModSoH,,,,,,,,Module SoH,,Module State of health. expressed as percentage,
,40297,CellV,,,uint16,,CellV,,,Cell Voltage,,Cell Voltage,Cell terminal voltage
164,40298,4 | MOdCeI 'VMaxCell,,,,,,,,Max Cell Voltage Cell,,Tell with maximum voltage,
165,40299,CellV,,,uint16,,CellV_SF,,,'MIO Cell Volta e,,Cell Voltage,Cell terminal voltage
,40300,CellV,,,uint16,,,,,I Min Cell Voltage Cell,,Cell Voltage,Cell terminal voltage
167,40301,CellV,,,uint16,,CellV,,,*vage Sell Voltage | Vax Cell Temperature,,Cell Voltage,Cell terminal voltage
168,40302,8 | I ModCel IT mpMax,,,,,Modlm,c,,Vax Cell Temperature,,Maximum temperature for all cells in the module,
169 f,40303,CellTmp,,,int16,,,,,Max Cell Temperature Cell,,Cell Temperature,Cell temperature
170,40304,CellTmp,,,int16,,ModTm,c,,M,,Cell Temperature,Cell temperature
,40305,CellTmp,,,int16,,,,,Min Cell Temperature Cell,,Cell Temperature,Cell temperature
172,40306,CellTmp,,,int16,,ModTm,c,,Average Celi Temperature,,Cell Temperature,Cell temperature
173,40307,13,,,,,,,,Pea,,'Pad reg ster,
o,40310,ID,805,,uint16,,,,,S,,Model ID,Model identifier
,40311,L,,,uint16,1,,,,S,,Model Length,Model length
2,40312,Strldx,,,uint16,,,,,,,String Index,Index of the string containing the module | index of the module within the string
3,40313,Modi,,,uint16,1,,,,,,'Module Index,ICount of all cells in the module | index of the module within the string
6,40316,DoD,,,uint16,1,DoD,,,,,Depth of Discharge,: Depth of discharge for the module | Module state of health. expressed as a percentage
,40317,,,,uint16,,SoH SF,,,,,Module SoH,I Count of 'cycles executed | Module state of health. expressed as a percentage
8,40318,,,,int16,2,,,,,,Cycle Count,I Count of 'cycles executed
15 | 10,40320,,,,uint16,,,v,,,,Module Voltage,Voltage of the module | Maximum cells in the module
17 | 12,40322,CellV,,,uint16,1,,,,,,Cell Voltage,Cell terminal voltage
18 | 13,40323,CellV,,,uint16,,CellV SF,,,,,Cell Voltage,Cell terminal voltage
19 | 14,40324,CellV,,,uint16,,,,,,,Cell Voltage,Cell terminal voltage
20 | 15,40325,CellV,,,uint16,1,CellV SF,,,,,Cell Voltage,Cell terminal voltage
21 | 16,40326,Ce I IT mpMax,,,int16,,Tmp_SF,c,,,,Max Cell Temperature,Maxrmum temperature for all cens in the module
22 | 17,40327,CeilTmpMaxCell,,,uint16,1,,,,,,Max Cell Temperature Cell,Cell wrth the maximum cell temperature | Mtn.mum temperature for all cells in the module
23 | 18,40328,CellTmp,,,int16,1,Imp _ SF,c,,,,Cell Temperature,Cell temperature
24 | 19,40329,CellTmp,,,uint16,1,,,,,,Cell Temperature,Cell temperature
25 | 20,40330,Cell TmpAve,,,int16,,Tmp.SF,c,,,,Average Cell Temperature,INumoer of cells currently being balanced in the module | Average temperature for all cens in the module
26 | 21,40331,,,,uint16,1,,,,,,Balanced Cell Count,INumoer of cells currently being balanced in the module
27 | 22 | 23,40332,SN,,,string,16,,,,'Serial Number,,,Sena' numeer for the module
40 | 42 | 37 | 39,40346,ISOH_SF | SOC_SF,,,sunssf,1,,,,,,,Scale factor for module state of health | Scale factor for module state of cnerze
46 | 39 | 41 | 42,40352,CellV,,,sunssf,1,,-y,,,,Cell Voltage,Cell terminal voltage
,40354,CellV,,,sunssf,,,,,,,Cell Voltage,Cell terminal voltage
,40355,CellTmp,,,uint16,,,v,,Cell Voltage,,Cell Temperature,Cell temperature
,40356,CellSt,,,bitfield32,,SF,c,,Cell Status | Cell Temperature,,Cell Status,Status of the cell
48,40358,CellV,,,uint16,,,,,,,Cell Voltage,Cell terminal voltage
49 | so,40359,CellTmp,,,int16,,,v | c,,Cell Voltage | Cell Temperature,,Cell Temperature,Cell temperature
so | 51 | 57,40361,CellSt,,,sunssf,,,c,,Cell Status | Cell Voltage,,Cell Status,Status of the cell
52 | 53,40362,CellTmp,,,uint16,,,c,,Cell Voltage,,Cell Temperature,Cell temperature
34,40365,CellSt,,,bitfield32,,,c,,Cell Status | Cen Temperature,,Cell Status,Status of the cell
56,40366,CellV,,,uint16,,,,,,,Cell Voltage,Cell terminal voltage
58,40368,CellSt,,,bitfield32,,,,,Cell Temperature,,Cell Status,Status of the cell
60 | 61,40370,CellV,,,uint16,,,v,,Ceil Voltage,,Cell Voltage,Cell terminal voltage
61 | 62,40372,CellTmp,,,bitfield32,,,,,Ceil Status | Cell Temperature,,Cell Temperature,Cell temperature
64,40374,CellV,,,uint16,,SF,,,Cell Voltage,,Cell Voltage,Cell terminal voltage
,40376,CellSt,,,bitfield32,,,,,Cell Temperature | Cell Status,,Cell Status,Status of the cell
67,40377,,,,,,,,,,,Status of the cellS,
68,40378,CellV,,,uint16,,,,,'Cell Voltage,,Cell Voltage,Cell terminal voltage
,40379,CellTmp,,,int16,,,c,,",Cell Temperature",,Cell Temperature,Cell temperature
71 | 78,40381,CellTmp,,,bitfield32,,,,,Cell Status | •Cell Temperature,,Cell Temperature,Cell temperature
72,40382,CellV,,,uint16,,,v,,'Cell Voltage,,Cell Voltage,Cell terminal voltage
73,40383,CellTmp,,,int16,,,c,,Cell Temperature,,Cell Temperature,Cell temperature
74,40384,CellSt,,,bitfield32,,,,,Cell Status,,Cell Status,Status of the cell
,40386,CellV,,,uint16,,SF,v,,Cell Voltage,,Cell Voltage,Cell terminal voltage
78 | 79,40389,CellSt,,,bitfield32,,,,,Cell Status,,Cell Status,Status of the cell
80,40390,CellV,,,uint16,,,v,,Cell Voltage,,Cell Voltage,Cell terminal voltage
81 | 87,40391,CellTmp,,,bitfield32,,Tmp_SF,c,,Cell Temperature | Cell Status | Cell Voltage,,Cell Temperature,Cell temperature
82,40392,CellSt,,,bitfield32,,,,,Cen Status,,Cell Status,Status of the cell
83 | 84,40393,CellV,,,int16,,,v,,Cell Voltage | Cell Status,,Cell Voltage,Cell terminal voltage
88,40398,CellV,,,uint16,,,,,,,Cell Voltage,Cell terminal voltage
